{
  "id": "tomato-goat-cheese-and-herbs-pasta",
  "title": "Tomato, Goat Cheese, and Herbs Pasta",
  "categories": {
    "method": [
      "stovetop"
    ],
    "diet": [
      "vegetarian",
      "pescatarian",
      "nut free"
    ],
    "meal": [
      "dinner"
    ],
    "season": [],
    "cuisine": [],
    "main_ingredient": []
  },
  "tags": [],
  "ingredients": [
    {
      "id": "i1",
      "name": "pasta",
      "amount": 1,
      "unit": "lb",
      "notes": ""
    },
    {
      "id": "i2",
      "name": "olive oil",
      "amount": 0.5,
      "unit": "cup",
      "notes": ""
    },
    {
      "id": "i3",
      "name": "cloves garlic, minced",
      "amount": 4,
      "unit": null,
      "notes": ""
    },
    {
      "id": "i4",
      "name": "cherry tomatoes,, quartered",
      "amount": 2,
      "unit": "cup",
      "notes": ""
    },
    {
      "id": "i5",
      "name": "goat cheese (1.5 cup), crumbled",
      "amount": 6,
      "unit": "oz",
      "notes": ""
    },
    {
      "id": "i6",
      "name": "parsley, minced",
      "amount": 0.25,
      "unit": "cup",
      "notes": ""
    },
    {
      "id": "i7",
      "name": "fresh herbs, mint, tarragon, basil, etc., minced",
      "amount": 0.25,
      "unit": "cup",
      "notes": ""
    }
  ],
  "steps": [
    {
      "id": "s1",
      "text": "Prepare the CHERRY TOMATOES, goat cheese, and herbs. While the pasta is cooking, heat the oil and garlic in a small saucepan over moderately low heat. Remove as soon as garlic begins to turn color, and pour it over the cooked and drained pasta (fettucine). Add the remaining ingredients and toss."
    }
  ],
  "notes": "",
  "created_at": "2026-09-15T00:00:00Z",
  "updated_at": "2026-09-15T20:22:34Z"
}
