{
  "id": "potage-parmentier-leek-and-potato-soup",
  "title": "Potage Parmentier (leek and potato soup)",
  "categories": {
    "method": [
      "stovetop"
    ],
    "diet": [],
    "meal": [
      "dinner"
    ],
    "season": [],
    "cuisine": [
      "french"
    ],
    "main_ingredient": []
  },
  "tags": [
    "soup"
  ],
  "ingredients": [
    {
      "id": "i1",
      "name": "(3 cups) leeks",
      "amount": 1,
      "unit": "lb",
      "notes": ""
    },
    {
      "id": "i2",
      "name": "butter",
      "amount": 1.5,
      "unit": "tbsp",
      "notes": "original quantity: 1-2"
    },
    {
      "id": "i3",
      "name": "(3 cups) potatoes (Idaho or starchy)",
      "amount": 1,
      "unit": "lb",
      "notes": ""
    },
    {
      "id": "i4",
      "name": "chicken stock, water, or some combination",
      "amount": 6,
      "unit": "cup",
      "notes": ""
    },
    {
      "id": "i5",
      "name": "salt (potentially more to taste)",
      "amount": 1.5,
      "unit": "tsp",
      "notes": ""
    },
    {
      "id": "i6",
      "name": "sour cream or 1.5 oz butter",
      "amount": 4,
      "unit": "tbsp",
      "notes": ""
    },
    {
      "id": "i7",
      "name": "parsley, chervril, tarragon, or chive garni",
      "amount": 3,
      "unit": "tbsp",
      "notes": ""
    }
  ],
  "steps": [
    {
      "id": "s1",
      "text": "Slice white and tender green parts of leeks along long axis. Wash, then chop. Sautee in large saucepan with butter."
    },
    {
      "id": "s2",
      "text": "Cut potatoes to 3/4 inch cubes. Add to leeks. Add enough water to cover by 1/2 inch."
    },
    {
      "id": "s3",
      "text": "Bring to boil, partially cover, reduce heat to low, then simmer until tender, about 30-40 minutes."
    },
    {
      "id": "s4",
      "text": "Process vegetables in several batches in a mouli (best), or through a food processer or blender, or press with a potato masher. Additional water or milk can be added if too thick. The soup can be served directly, or returned to saucepan and reheated when ready to serve. OPTIONAL: To each bowl, add a spoonful of heavy cream, yogurt or a small pat of softened butter. Sprinkle with minced parsley or chopped chives."
    }
  ],
  "attribution": {
    "name": "Lorraine (possibly originally from Cooks Illustrated)"
  },
  "notes": "Variations, or Soupe Du Jour In the beginning, add chopped carrots or tomatoes. OR, half-way through add diced cauliflower, cucumbers, broccoli, zucchini, or lima beans. OR, 5 minutes before the end of cooking add diced, cooked leftover vegetables. OR, can replace part of water with milk, or add powdered milk. OR, make it creamy by adding 1/2 C heavy cream just before serving. Flavoring - add pepper, marjoram, basil, savory and/or bay leaf CHILLED: Add a little more salt and 1/2 C cream before refrigerating, then taste again before serving. OR, add a bunch watercress leaves and stems for last 5 minutes of cooking. Puree.",
  "created_at": "2026-09-15T00:00:00Z",
  "updated_at": "2026-09-15T00:00:00Z"
}
