{
  "id": "roasted-cabbage-with-parmesan-walnuts-and-anchovies",
  "title": "Roasted Cabbage With Parmesan, Walnuts and Anchovies",
  "categories": {
    "method": [
      "sheet pan",
      "baking"
    ],
    "diet": [
      "pescatarian",
      "gluten free"
    ],
    "meal": [
      "side dish"
    ],
    "season": [],
    "cuisine": [],
    "main_ingredient": []
  },
  "tags": [],
  "servings": 4,
  "cook_time_minutes": 45,
  "ingredients": [
    {
      "id": "i1",
      "name": "medium head green cabbage",
      "amount": 2.5,
      "unit": "lb"
    },
    {
      "id": "i2",
      "name": "extra-virgin olive oil",
      "amount": 0.5,
      "unit": "cup",
      "notes": "plus more as needed"
    },
    {
      "id": "i3",
      "name": "salt",
      "amount": 1,
      "unit": "pinch",
      "notes": "as needed"
    },
    {
      "id": "i4",
      "name": "Parmesan",
      "amount": 0.75,
      "unit": "cup",
      "notes": "finely grated, plus more for serving"
    },
    {
      "id": "i5",
      "name": "anchovy fillets",
      "amount": 6,
      "unit": null,
      "notes": "minced"
    },
    {
      "id": "i6",
      "name": "fat garlic cloves",
      "amount": 2,
      "unit": null,
      "notes": "finely grated, pressed or minced"
    },
    {
      "id": "i7",
      "name": "fresh thyme leaves",
      "amount": 1,
      "unit": "tsp"
    },
    {
      "id": "i8",
      "name": "freshly ground black pepper",
      "amount": 0.5,
      "unit": "tsp",
      "notes": "plus more as needed"
    },
    {
      "id": "i9",
      "name": "walnuts or other nuts",
      "amount": 0.6666666667,
      "unit": "cup",
      "notes": "chopped"
    },
    {
      "id": "i10",
      "name": "fresh dill or cilantro",
      "amount": 0.5,
      "unit": "cup",
      "notes": "chopped"
    }
  ],
  "steps": [
    {
      "id": "s1",
      "text": "Heat oven to 450 degrees F. Quarter cabbage lengthwise through the core, remove cores and stem, then cut lengthwise into 1 1/2-inch-thick wedges."
    },
    {
      "id": "s2",
      "text": "Place wedges flat-side down on a rimmed sheet pan without overlapping if possible. Lightly drizzle with oil and season with salt."
    },
    {
      "id": "s3",
      "text": "Combine Parmesan, anchovies, garlic, thyme and pepper. Stir in 1/2 cup oil to make a loose paste, then massage it into each wedge and between the leaves."
    },
    {
      "id": "s4",
      "text": "Drizzle cabbage with a little more oil and roast until lightly browned, 25 to 30 minutes."
    },
    {
      "id": "s5",
      "text": "Sprinkle walnuts over cabbage and roast about 5 minutes more, until cabbage is tender and caramelized and nuts are golden."
    },
    {
      "id": "s6",
      "text": "Sprinkle with dill, more Parmesan and black pepper as desired. Serve immediately."
    }
  ],
  "attribution": {
    "name": "Melissa Clark",
    "url": "https://cooking.nytimes.com/recipes/1023053-roasted-cabbage-with-parmesan-walnuts-and-anchovies"
  },
  "created_at": "2026-09-15T18:00:00Z",
  "updated_at": "2026-09-15T20:22:34Z"
}
