{
  "id": "miso-glazed-fish",
  "title": "Miso-Glazed Fish",
  "categories": {
    "method": [
      "baking"
    ],
    "diet": [
      "dairy free"
    ],
    "meal": [
      "dinner"
    ],
    "season": [],
    "cuisine": [
      "japanese"
    ],
    "main_ingredient": [
      "fish"
    ]
  },
  "tags": [],
  "ingredients": [
    {
      "id": "i1",
      "name": "red or white miso paste",
      "amount": 0.25,
      "unit": "cup",
      "notes": ""
    },
    {
      "id": "i2",
      "name": "sake",
      "amount": 0.25,
      "unit": "cup",
      "notes": ""
    },
    {
      "id": "i3",
      "name": "mirin",
      "amount": 2,
      "unit": "tbsp",
      "notes": ""
    },
    {
      "id": "i4",
      "name": "soy sauce",
      "amount": 2,
      "unit": "tsp",
      "notes": ""
    },
    {
      "id": "i5",
      "name": "vegetable oil",
      "amount": 1,
      "unit": "tbsp",
      "notes": ""
    },
    {
      "id": "i6",
      "name": "sugar",
      "amount": 0.25,
      "unit": "cup",
      "notes": ""
    },
    {
      "id": "i7",
      "name": "black cod filets, 5 to 6 ounces each",
      "amount": 4,
      "unit": null,
      "notes": ""
    }
  ],
  "steps": [
    {
      "id": "s1",
      "text": "Whisk together miso, sake, mirin, soy sauce, oil, and sugar. Rub mixture over every surface of black filets. Transfer to a plastic zipper lock bag or sealable container. Proceed immediately to next step, or for best results, marinate for about 30 minutes or up to two days."
    },
    {
      "id": "s2",
      "text": "Adjust broiler rack to 4 inches from heat source and preheat broiler or toaster oven broiler to high. Cover a small broiler pan with aluminum foil. Place black cod filets skin side-down on pan. Broil until top surface is well charred and a thin skewer inserted into black cod shows no resistance at all when piercing through layers of flesh, about 10 minutes. If any areas of fish threaten to burn, shield with small pieces of aluminum foil."
    },
    {
      "id": "s3",
      "text": "When fish is cooked, carefully remove pin bones with a pair of tweezers (there should be no resistence), and serve immediately."
    }
  ],
  "notes": "Very good with black cod. Probably quite good with other fishies.",
  "created_at": "2026-09-15T00:00:00Z",
  "updated_at": "2026-09-15T19:13:10Z"
}
